Название светильника,Цена,Ссылка как заказать
name,price,url
Подвесной светильник Ферум Orange,4990,/product/podvesnoj-svetilnik-ferum-orange
Светильник потолочный Ринга Black,3990,/product/svetilnik-potolochnyj-ringa-black
Торшер Бьйорк White,11 990,/product/torsher-bjork-white
Подвесной светильник Тубули-5 Wood,12 990,/product/podvesnoj-svetilnik-tubuli-5-wood
Бра Смастен White,4990,/product/bra-smasten-white
Настольная лампа Арвика Wood,5990,/product/nastolnaya-lampa-arvika-wood
Подвесной светильник Инлада Wood,9990,/product/podvesnoj-svetilnik-inlada-wood
Подвесной светильник Намсен Black,10 990,/product/podvesnoj-svetilnik-namsen-black
Торшер Алней-2 White,6990,/product/torsher-alnej-2-white
Люстра Ливсден Brown,16 990,/product/lyustra-livsden-brown
Подвесной светильник Гронтри-1 Wood,13 990,/product/podvesnoj-svetilnik-grontri-1-wood
Бра Бракетт White,3990,/product/bra-brakett-white
Подвесной светильник Отра Wood,16 990,/product/podvesnoj-svetilnik-otra-wood
Торшер Алней-2 Black,6990,/product/torsher-alnej-2-black
Светильник потолочный Орхус White,16 990,/product/svetilnik-potolochnyj-orhus-white
Подвесной светильник Рена Green,4990,/product/podvesnoj-svetilnik-rena-green
Светильник потолочный Ринга White,3990,/product/svetilnik-potolochnyj-ringa-white
Настольная лампа Логмар Black,6490,/product/nastolnaya-lampa-logmar-black
Бра Берит Black,3990,/product/bra-berit-black
Подвесной светильник Кронор Black,7990,/product/podvesnoj-svetilnik-kronor-black
Настольная лампа Бьйорк White,3990,/product/nastolnaya-lampa-bjork-white
Подвесной светильник Селау-2 Glass,3990,/product/podvesnoj-svetilnik-selau-2-glass
Торшер Алней-2 Green,6990,/product/torsher-alnej-2-green
Подвесной светильник Джамби Rattan,13 990,/product/podvesnoj-svetilnik-djambi-rattan
Бра Пинна Black,6990,/product/bra-pinna-black
Подвесной светильник Бьйорк White,7990,/product/podvesnoj-svetilnik-bjork-white
Торшер Осло Blue,17 990,/product/torsher-oslo-blue
Настольная лампа Чэд Black,3990,/product/nastolnaya-lampa-ched-black
Бра Бьйорк White,2990,/product/bra-bjork-white
Подвесной светильник Арвика Wood,7990,/product/podvesnoj-svetilnik-arvika-wood
Подвесной светильник Бенфлит Black,6990,/product/podvesnoj-svetilnik-benflit-black
Светильник потолочный Орхус Black,16 990,/product/svetilnik-potolochnyj-orhus-black
Торшер Алней-2 Orange,6990,/product/torsher-alnej-2-orange
Настольная лампа Требен Orange,3290,/product/nastolnaya-lampa-treben-orange
Подвесной светильник Ливсден Brown,4990,/product/podvesnoj-svetilnik-livsden-brown
Настольная лампа Филикс Black,3990,/product/nastolnaya-lampa-filiks-black
Подвесной светильник Бейла Black,5990,/product/podvesnoj-svetilnik-bejla-black
Светильник потолочный Лаго White,11 990,/product/svetilnik-potolochnyj-lago-white
Подвесной светильник Чинкве Silver,5990,/product/podvesnoj-svetilnik-chinkve-silver
Торшер Энкель Black,5990,/product/torsher-enkel-black
Люстра Малинг Multi,14 990,/product/lyustra-maling-multi
Подвесной светильник Джамби-1 Rattan,6990,/product/podvesnoj-svetilnik-djambi-1-rattan
Подвесной светильник Селау-1 Glass,4990,/product/podvesnoj-svetilnik-selau-1-glass
Подвесной светильник Ферум Black,3990,/product/podvesnoj-svetilnik-ferum-black
Бра Смастен Black,4990,/product/bra-smasten-black
Подвесной светильник Кронор White,7990,/product/podvesnoj-svetilnik-kronor-white
Подвесной светильник Тубули Wood,2990,/product/podvesnoj-svetilnik-tubuli-wood
Настольная лампа Требен White,3290,/product/nastolnaya-lampa-treben-white
